<?xml version="1.0" encoding="UTF-8"?>


<tns:alertMetadata xmlns:tns="http://www.ibm.com/teal/alertmeta" xmlns:xsi="http://www.w3.org/2001/XMLSchema-instance" xsi:schemaLocation="http://www.ibm.com/teal/alertmeta ../../../../../../xml/alertmeta.xsd ">
  <tns:alert id="E0000001">
    <tns:msg_template>This is Alert 01</tns:msg_template>
    <tns:recommendation>Recommend doing something</tns:recommendation>
    <tns:urgency>N</tns:urgency>
    <tns:severity>W</tns:severity>
    <tns:call_home>N</tns:call_home>
    <tns:cust_notification>N</tns:cust_notification>
    <tns:fru_class>fru_class</tns:fru_class>
    <tns:fru_list>fru_list1, fru_list2</tns:fru_list>
  </tns:alert>
  <tns:alert id="E0000002">
    <tns:msg_template>This is Alert 02</tns:msg_template>
    <tns:recommendation>Recommend doing something</tns:recommendation>
    <tns:urgency>N</tns:urgency>
    <tns:severity>W</tns:severity>
    <tns:call_home>N</tns:call_home>
    <tns:cust_notification>N</tns:cust_notification>
    <tns:fru_class>fru_class</tns:fru_class>
    <tns:fru_list>fru_list1, fru_list2</tns:fru_list>
  </tns:alert>
  <tns:alert id="E0000003">
    <tns:msg_template>This is Alert 03</tns:msg_template>
    <tns:recommendation>Recommend doing something</tns:recommendation>
    <tns:urgency>N</tns:urgency>
    <tns:severity>W</tns:severity>
    <tns:call_home>N</tns:call_home>
    <tns:cust_notification>N</tns:cust_notification>
    <tns:fru_class>fru_class</tns:fru_class>
    <tns:fru_list>fru_list1, fru_list2</tns:fru_list>
  </tns:alert>
  <tns:alert id="E0000004">
    <tns:msg_template>This is Alert 04</tns:msg_template>
    <tns:recommendation>Recommend doing something</tns:recommendation>
    <tns:urgency>N</tns:urgency>
    <tns:severity>W</tns:severity>
    <tns:call_home>N</tns:call_home>
    <tns:cust_notification>N</tns:cust_notification>
    <tns:fru_class>fru_class</tns:fru_class>
    <tns:fru_list>fru_list1, fru_list2</tns:fru_list>
  </tns:alert>
  <tns:alert id="E0000005">
    <tns:msg_template>This is Alert 05</tns:msg_template>
    <tns:recommendation>Recommend doing something</tns:recommendation>
    <tns:urgency>N</tns:urgency>
    <tns:severity>W</tns:severity>
    <tns:call_home>N</tns:call_home>
    <tns:cust_notification>N</tns:cust_notification>
    <tns:fru_class>fru_class</tns:fru_class>
    <tns:fru_list>fru_list1, fru_list2</tns:fru_list>
  </tns:alert>
  <tns:alert id="E0000006">
    <tns:msg_template>This is Alert 06</tns:msg_template>
    <tns:recommendation>Recommend doing something</tns:recommendation>
    <tns:urgency>N</tns:urgency>
    <tns:severity>W</tns:severity>
    <tns:call_home>N</tns:call_home>
    <tns:cust_notification>N</tns:cust_notification>
    <tns:fru_class>fru_class</tns:fru_class>
    <tns:fru_list>fru_list1, fru_list2</tns:fru_list>
  </tns:alert>
  <tns:alert id="E0000007">
    <tns:msg_template>This is Alert 07</tns:msg_template>
    <tns:recommendation>Recommend doing something</tns:recommendation>
    <tns:urgency>N</tns:urgency>
    <tns:severity>W</tns:severity>
    <tns:call_home>N</tns:call_home>
    <tns:cust_notification>N</tns:cust_notification>
    <tns:fru_class>fru_class</tns:fru_class>
    <tns:fru_list>fru_list1, fru_list2</tns:fru_list>
  </tns:alert>
  <tns:alert id="E0000008">
    <tns:msg_template>This is Alert 08</tns:msg_template>
    <tns:recommendation>Recommend doing something</tns:recommendation>
    <tns:urgency>N</tns:urgency>
    <tns:severity>W</tns:severity>
    <tns:call_home>N</tns:call_home>
    <tns:cust_notification>N</tns:cust_notification>
    <tns:fru_class>fru_class</tns:fru_class>
    <tns:fru_list>fru_list1, fru_list2</tns:fru_list>
  </tns:alert>
  <tns:alert id="E0000009">
    <tns:msg_template>This is Alert 09</tns:msg_template>
    <tns:recommendation>Recommend doing something</tns:recommendation>
    <tns:urgency>N</tns:urgency>
    <tns:severity>W</tns:severity>
    <tns:call_home>N</tns:call_home>
    <tns:cust_notification>N</tns:cust_notification>
    <tns:fru_class>fru_class</tns:fru_class>
    <tns:fru_list>fru_list1, fru_list2</tns:fru_list>
  </tns:alert>
  <tns:alert id="E0000010">
    <tns:msg_template>This is Alert 10</tns:msg_template>
    <tns:recommendation>Recommend doing something</tns:recommendation>
    <tns:urgency>N</tns:urgency>
    <tns:severity>W</tns:severity>
    <tns:call_home>N</tns:call_home>
    <tns:cust_notification>N</tns:cust_notification>
    <tns:fru_class>fru_class</tns:fru_class>
    <tns:fru_list>fru_list1, fru_list2</tns:fru_list>
  </tns:alert>
  <tns:alert id="E0000011">
    <tns:msg_template>This is Alert 11</tns:msg_template>
    <tns:recommendation>Recommend doing something</tns:recommendation>
    <tns:urgency>N</tns:urgency>
    <tns:severity>W</tns:severity>
    <tns:call_home>N</tns:call_home>
    <tns:cust_notification>N</tns:cust_notification>
    <tns:fru_class>fru_class</tns:fru_class>
    <tns:fru_list>fru_list1, fru_list2</tns:fru_list>
  </tns:alert>
  <tns:alert id="E0000012">
    <tns:msg_template>This is Alert 12</tns:msg_template>
    <tns:recommendation>Recommend doing something</tns:recommendation>
    <tns:urgency>N</tns:urgency>
    <tns:severity>W</tns:severity>
    <tns:call_home>N</tns:call_home>
    <tns:cust_notification>N</tns:cust_notification>
    <tns:fru_class>fru_class</tns:fru_class>
    <tns:fru_list>fru_list1, fru_list2</tns:fru_list>
  </tns:alert>
  <tns:alert id="E0000013">
    <tns:msg_template>This is Alert 13</tns:msg_template>
    <tns:recommendation>Recommend doing something</tns:recommendation>
    <tns:urgency>N</tns:urgency>
    <tns:severity>W</tns:severity>
    <tns:call_home>N</tns:call_home>
    <tns:cust_notification>N</tns:cust_notification>
    <tns:fru_class>fru_class</tns:fru_class>
    <tns:fru_list>fru_list1, fru_list2</tns:fru_list>
  </tns:alert>  
  <tns:alert id="BD00FFF0">
    <tns:msg_template>This is A failure alert</tns:msg_template>
    <tns:recommendation>Recommend doing something</tns:recommendation>
    <tns:urgency>N</tns:urgency>
    <tns:severity>W</tns:severity>
    <tns:call_home>N</tns:call_home>
    <tns:cust_notification>N</tns:cust_notification>
    <tns:fru_class>fru_class</tns:fru_class>
    <tns:fru_list>fru_list1, fru_list2</tns:fru_list>
  </tns:alert>
</tns:alertMetadata>
